<?xml version="1.0" encoding="UTF-8"?>
<GenerateModel xmlns:xsi="http://www.w3.org/2001/XMLSchema-instance" xsi:noNamespaceSchemaLocation="generateMetaModel_Module.xsd">
  <PythonExport
      Father="PyObjectBase"
      Name="ShapeFix_EdgePy"
      PythonName="Part.ShapeFix.Edge"
      Twin="ShapeFix_Edge"
      TwinPointer="ShapeFix_Edge"
      Include="ShapeFix_Edge.hxx"
      Namespace="Part"
      FatherInclude="Base/PyObjectBase.h"
      FatherNamespace="Base"
      Constructor="true"
      Delete="false">
    <Documentation>
      <Author Licence="LGPL" Name="Werner Mayer" EMail="wmayer@users.sourceforge.net" />
      <UserDocu>Fixing invalid edge</UserDocu>
    </Documentation>
    <Methode Name="fixRemovePCurve">
      <Documentation>
        <UserDocu>Removes pcurve(s) if not matching vertices.</UserDocu>
      </Documentation>
    </Methode>
    <Methode Name="fixRemoveCurve3d">
      <Documentation>
        <UserDocu>Removes 3d curve if not matching vertices.</UserDocu>
      </Documentation>
    </Methode>
    <Methode Name="fixAddPCurve">
      <Documentation>
        <UserDocu>Adds missing pcurve(s) by projecting 3d curve.</UserDocu>
      </Documentation>
    </Methode>
    <Methode Name="fixAddCurve3d">
      <Documentation>
        <UserDocu>Tries to build missing 3d curve.</UserDocu>
      </Documentation>
    </Methode>
    <Methode Name="fixVertexTolerance">
      <Documentation>
        <UserDocu>Increases tolerances of edge vertices.</UserDocu>
      </Documentation>
    </Methode>
    <Methode Name="fixReversed2d">
      <Documentation>
        <UserDocu>Fixes edge if pcurve is opposite to 3d curve.</UserDocu>
      </Documentation>
    </Methode>
    <Methode Name="fixSameParameter">
      <Documentation>
        <UserDocu>Makes edge SameParameter and sets tolerance.</UserDocu>
      </Documentation>
    </Methode>
    <ClassDeclarations>
private:
    Handle(ShapeFix_Edge) hEdge;

public:
    void setHandle(Handle(ShapeFix_Edge) handle) {
        setTwinPointer(handle.get());
        hEdge = handle;
    }
    </ClassDeclarations>
  </PythonExport>
</GenerateModel>
